{
  "candidateId": "modern-photo-slideshow-envato--scene-016",
  "dataAssignments": [],
  "evidence": [
    {
      "kind": "source_requirement",
      "quote": "And the rappers this should really be measured against — the ones whose seventeenth year happened before streaming counted anything — can't go on this chart at all. There's no daily meter for Jay-Z's year seventeen."
    }
  ],
  "mediaAssignments": [],
  "renderingAuthorized": false,
  "requestSha256": "52dad27464bf1ed7bf7f8ea82d6481f8eef18e1f219ab403e06b3e78b14cb9ff",
  "reviewState": "model_draft_unreviewed",
  "schemaVersion": 1,
  "selectionAuthorized": false,
  "taskId": "30-30a.main",
  "textAssignments": [],
  "timingProposal": {
    "evidence": "duration observation only",
    "nativeDurationSeconds": 8.700000000000003,
    "proposedAdjustments": null,
    "status": "unresolved_user_policy",
    "taskDurationSeconds": 12.52
  },
  "treatmentSummary": "No native assignments are proposed because the request leaves treatment-specific media, text, data, semantic-fit, or timing decisions unresolved; the verified native controls remain available for editor review.",
  "unresolved": [
    {
      "field": "mediaAssignments",
      "reason": "The request does not provide a reviewed treatment-specific media-slot count and media-kind assignment, so no native media slot can be assigned without invention."
    },
    {
      "field": "textAssignments",
      "reason": "The request does not identify treatment-required exact on-screen strings or a reviewed mapping to native text fields."
    },
    {
      "field": "dataAssignments",
      "reason": "The request provides semantic constraints or encoding categories but no exact typed data fields and values for this treatment."
    },
    {
      "field": "semanticTreatmentMapping",
      "reason": "No reviewed assignment proves that this candidate treatment makes every truth and perceptibility constraint legible while avoiding every prohibited implication."
    },
    {
      "field": "timingProposal.proposedAdjustments",
      "reason": "The request requires a user decision before trim, loop, freeze, speed change, or extension can be proposed."
    },
    {
      "field": "editorReview",
      "reason": "This is an unreviewed model draft and cannot approve, select, or authorize the candidate."
    }
  ],
  "verdict": null
}
