{
  "candidateId": "06-the-history--scene-001",
  "dataAssignments": [],
  "evidence": [
    {
      "kind": "source_requirement",
      "quote": "In 2010, XXL offered him a spot on the Freshman cover. He turned it down."
    },
    {
      "kind": "verified_native_fact",
      "quote": "The approved clip is SEQ_1, and the native | SEQ_ALL timeline starts with the SEQ_1 composition at 0 seconds."
    }
  ],
  "mediaAssignments": [],
  "renderingAuthorized": false,
  "requestSha256": "31cdc2107fffb70a41092d53242e59e893c02d367e6a8455e91ccbbd016a046b",
  "reviewState": "model_draft_unreviewed",
  "schemaVersion": 1,
  "selectionAuthorized": false,
  "taskId": "15-15.main",
  "textAssignments": [
    {
      "contentRole": "Carry one source-stated label or value",
      "evidence": "In 2010, XXL offered him a spot on the Freshman cover. He turned it down.",
      "fieldId": "text:2124204255:1",
      "fitStatus": "unverified",
      "text": "2010"
    },
    {
      "contentRole": "Carry one source-stated label or value",
      "evidence": "In 2010, XXL offered him a spot on the Freshman cover. He turned it down.",
      "fieldId": "text:2124204255:2",
      "fitStatus": "unverified",
      "text": "XXL Freshman cover"
    },
    {
      "contentRole": "Carry one source-stated label or value",
      "evidence": "In 2010, XXL offered him a spot on the Freshman cover. He turned it down.",
      "fieldId": "text:2124207796:1",
      "fitStatus": "unverified",
      "text": "Drake turned it down"
    }
  ],
  "timingProposal": {
    "evidence": "duration observation only",
    "nativeDurationSeconds": 10.0,
    "proposedAdjustments": null,
    "status": "unresolved_user_policy",
    "taskDurationSeconds": 5.86
  },
  "treatmentSummary": "Propose only the source-supported assignments listed below; all unverified treatment demands and timing choices remain for editor review.",
  "unresolved": [
    {
      "field": "native identity presentation",
      "reason": "The task names display-eligible identities, but the exact native composition exposes no verified media slot; text fields are not assumed to be media controls."
    },
    {
      "field": "treatment required media slot count",
      "reason": "A typed editor/treatment media requirement is bound to this exact VisualTask."
    },
    {
      "field": "treatment required text field count",
      "reason": "The narration and semantic constraints do not specify which content must appear as editable on-screen text for a particular treatment."
    },
    {
      "field": "text character, line, and wrapping fit",
      "reason": "The narration and semantic constraints do not specify which content must appear as editable on-screen text for a particular treatment."
    },
    {
      "field": "task required typed data fields",
      "reason": "Encoding categories are source-bound, but exact typed field names and values are not present in the current VisualTask contract."
    },
    {
      "field": "proposed text fit",
      "reason": "The exact strings are source-supported proposals only; character, line, and wrapping fit has not been verified."
    },
    {
      "field": "timing adjustment policy",
      "reason": "The request requires a user decision before trim, loop, freeze, speed change, or extension can be proposed."
    }
  ],
  "verdict": null
}
