{
  "candidateId": "photo-slideshow-memories-envato--scene-003",
  "dataAssignments": [],
  "evidence": [
    {
      "kind": "source_requirement",
      "quote": "and one other rapper in the set has that streak — J. Cole, off the cover he turned down."
    }
  ],
  "mediaAssignments": [],
  "renderingAuthorized": false,
  "requestSha256": "e9910734594716b13d99d7266dab562ecef469b4c5090710d714048a7c9a8100",
  "reviewState": "model_draft_unreviewed",
  "schemaVersion": 1,
  "selectionAuthorized": false,
  "taskId": "25-25b.main",
  "textAssignments": [],
  "timingProposal": {
    "evidence": "duration observation only",
    "nativeDurationSeconds": 7.859999999999999,
    "proposedAdjustments": null,
    "status": "unresolved_user_policy",
    "taskDurationSeconds": 6.62
  },
  "treatmentSummary": "No native assignments are proposed because the request leaves treatment-specific media, text, data, semantic-fit, or timing decisions unresolved; the verified native controls remain available for editor review.",
  "unresolved": [
    {
      "field": "mediaAssignments",
      "reason": "The request does not provide a reviewed treatment-specific media-slot count and media-kind assignment, so no native media slot can be assigned without invention."
    },
    {
      "field": "textAssignments",
      "reason": "The request does not identify treatment-required exact on-screen strings or a reviewed mapping to native text fields."
    },
    {
      "field": "dataAssignments",
      "reason": "The request provides semantic constraints or encoding categories but no exact typed data fields and values for this treatment."
    },
    {
      "field": "semanticTreatmentMapping",
      "reason": "No reviewed assignment proves that this candidate treatment makes every truth and perceptibility constraint legible while avoiding every prohibited implication."
    },
    {
      "field": "timingProposal.proposedAdjustments",
      "reason": "The request requires a user decision before trim, loop, freeze, speed change, or extension can be proposed."
    },
    {
      "field": "editorReview",
      "reason": "This is an unreviewed model draft and cannot approve, select, or authorize the candidate."
    }
  ],
  "verdict": null
}
