{
  "candidateId": "archive3-infographic-bar-charts--review-007",
  "dataAssignments": [],
  "evidence": [
    {
      "kind": "source_requirement",
      "quote": "Ab-Soul falls twenty-eight places. Latto falls thirteen. Jay Rock, twelve."
    },
    {
      "kind": "verified_native_fact",
      "quote": "Review item 007 is the 2014-through-2023 growth chart and matches native Bar Chart 07."
    }
  ],
  "mediaAssignments": [],
  "renderingAuthorized": false,
  "requestSha256": "3632e01d4f812e0eb2e09cd0d39e6ad2d399af9fe5186cc953fd5fa61882c99a",
  "reviewState": "model_draft_unreviewed",
  "schemaVersion": 1,
  "selectionAuthorized": false,
  "taskId": "12-12a.main",
  "textAssignments": [
    {
      "contentRole": "Carry one source-stated label or value",
      "evidence": "Ab-Soul falls twenty-eight places. Latto falls thirteen. Jay Rock, twelve.",
      "fieldId": "text:2707:10",
      "fitStatus": "unverified",
      "text": "Ab-Soul"
    },
    {
      "contentRole": "Carry one source-stated label or value",
      "evidence": "Ab-Soul falls twenty-eight places. Latto falls thirteen. Jay Rock, twelve.",
      "fieldId": "text:2707:11",
      "fitStatus": "unverified",
      "text": "−28 places"
    },
    {
      "contentRole": "Carry one source-stated label or value",
      "evidence": "Ab-Soul falls twenty-eight places. Latto falls thirteen. Jay Rock, twelve.",
      "fieldId": "text:2707:12",
      "fitStatus": "unverified",
      "text": "Latto"
    },
    {
      "contentRole": "Carry one source-stated label or value",
      "evidence": "Ab-Soul falls twenty-eight places. Latto falls thirteen. Jay Rock, twelve.",
      "fieldId": "text:2707:13",
      "fitStatus": "unverified",
      "text": "−13 places"
    },
    {
      "contentRole": "Carry one source-stated label or value",
      "evidence": "Ab-Soul falls twenty-eight places. Latto falls thirteen. Jay Rock, twelve.",
      "fieldId": "text:2707:14",
      "fitStatus": "unverified",
      "text": "Jay Rock"
    },
    {
      "contentRole": "Carry one source-stated label or value",
      "evidence": "Ab-Soul falls twenty-eight places. Latto falls thirteen. Jay Rock, twelve.",
      "fieldId": "text:2707:15",
      "fitStatus": "unverified",
      "text": "−12 places"
    }
  ],
  "timingProposal": {
    "evidence": "duration observation only",
    "nativeDurationSeconds": 20.0,
    "proposedAdjustments": null,
    "status": "unresolved_user_policy",
    "taskDurationSeconds": 5.26
  },
  "treatmentSummary": "Propose only the source-supported assignments listed below; all unverified treatment demands and timing choices remain for editor review.",
  "unresolved": [
    {
      "field": "native identity presentation",
      "reason": "The task names display-eligible identities, but the exact native composition exposes no verified media slot; text fields are not assumed to be media controls."
    },
    {
      "field": "treatment required media slot count",
      "reason": "A semantic identity can be encoded by media, text, a mark, or a grouped asset; the current VisualTask does not assign identities to template media slots."
    },
    {
      "field": "treatment required text field count",
      "reason": "The narration and semantic constraints do not specify which content must appear as editable on-screen text for a particular treatment."
    },
    {
      "field": "text character, line, and wrapping fit",
      "reason": "The narration and semantic constraints do not specify which content must appear as editable on-screen text for a particular treatment."
    },
    {
      "field": "task required typed data fields",
      "reason": "Encoding categories are source-bound, but exact typed field names and values are not present in the current VisualTask contract."
    },
    {
      "field": "native quantitative or relational encoding",
      "reason": "The narration contains values or relationships, but native media/text controls alone do not prove the template can encode that relationship."
    },
    {
      "field": "proposed text fit",
      "reason": "The exact strings are source-supported proposals only; character, line, and wrapping fit has not been verified."
    },
    {
      "field": "timing adjustment policy",
      "reason": "The request requires a user decision before trim, loop, freeze, speed change, or extension can be proposed."
    }
  ],
  "verdict": null
}
