{
  "candidateId": "photo-slideshow-memories-envato--scene-003",
  "dataAssignments": [],
  "evidence": [
    {
      "kind": "source_requirement",
      "quote": "The rappers on that cover, and on the one the year before, came up on the same clock he did. 2009: Kid Cudi, B.o.B, Wale, Curren$y. 2010: J. Cole, Nicki Minaj, Wiz Khalifa, Big Sean, Nipsey Hussle, Jay Rock, Freddie Gibbs."
    },
    {
      "kind": "verified_native_fact",
      "quote": "The reviewed 11.07–18.93 second boundary is bound to one exact native master-window anchor plus verified child layers spanning this master timeline; exact window capacity and receipts are frozen in reports/clip-mapping-batch-010.json."
    }
  ],
  "mediaAssignments": [
    {
      "content": "B.o.B",
      "contentRole": "Identify B.o.B as one member of the narrated cohort",
      "evidence": "The rappers on that cover, and on the one the year before, came up on the same clock he did. 2009: Kid Cudi, B.o.B, Wale, Curren$y. 2010: J. Cole, Nicki Minaj, Wiz Khalifa, Big Sean, Nipsey Hussle, Jay Rock, Freddie Gibbs.",
      "mediaKind": "person",
      "slotId": "comp:2124184497",
      "status": "proposed"
    },
    {
      "content": "Big Sean",
      "contentRole": "Identify Big Sean as one member of the narrated cohort",
      "evidence": "The rappers on that cover, and on the one the year before, came up on the same clock he did. 2009: Kid Cudi, B.o.B, Wale, Curren$y. 2010: J. Cole, Nicki Minaj, Wiz Khalifa, Big Sean, Nipsey Hussle, Jay Rock, Freddie Gibbs.",
      "mediaKind": "person",
      "slotId": "comp:2124184549",
      "status": "proposed"
    },
    {
      "content": "Curren$y",
      "contentRole": "Identify Curren$y as one member of the narrated cohort",
      "evidence": "The rappers on that cover, and on the one the year before, came up on the same clock he did. 2009: Kid Cudi, B.o.B, Wale, Curren$y. 2010: J. Cole, Nicki Minaj, Wiz Khalifa, Big Sean, Nipsey Hussle, Jay Rock, Freddie Gibbs.",
      "mediaKind": "person",
      "slotId": "comp:2124184564",
      "status": "proposed"
    },
    {
      "content": "Freddie Gibbs",
      "contentRole": "Identify Freddie Gibbs as one member of the narrated cohort",
      "evidence": "The rappers on that cover, and on the one the year before, came up on the same clock he did. 2009: Kid Cudi, B.o.B, Wale, Curren$y. 2010: J. Cole, Nicki Minaj, Wiz Khalifa, Big Sean, Nipsey Hussle, Jay Rock, Freddie Gibbs.",
      "mediaKind": "person",
      "slotId": "comp:2124184577",
      "status": "proposed"
    },
    {
      "content": "J. Cole",
      "contentRole": "Identify J. Cole as one member of the narrated cohort",
      "evidence": "The rappers on that cover, and on the one the year before, came up on the same clock he did. 2009: Kid Cudi, B.o.B, Wale, Curren$y. 2010: J. Cole, Nicki Minaj, Wiz Khalifa, Big Sean, Nipsey Hussle, Jay Rock, Freddie Gibbs.",
      "mediaKind": "person",
      "slotId": "comp:2124184813",
      "status": "proposed"
    },
    {
      "content": "Jay Rock",
      "contentRole": "Identify Jay Rock as one member of the narrated cohort",
      "evidence": "The rappers on that cover, and on the one the year before, came up on the same clock he did. 2009: Kid Cudi, B.o.B, Wale, Curren$y. 2010: J. Cole, Nicki Minaj, Wiz Khalifa, Big Sean, Nipsey Hussle, Jay Rock, Freddie Gibbs.",
      "mediaKind": "person",
      "slotId": "comp:2124184826",
      "status": "proposed"
    },
    {
      "content": "Kid Cudi",
      "contentRole": "Identify Kid Cudi as one member of the narrated cohort",
      "evidence": "The rappers on that cover, and on the one the year before, came up on the same clock he did. 2009: Kid Cudi, B.o.B, Wale, Curren$y. 2010: J. Cole, Nicki Minaj, Wiz Khalifa, Big Sean, Nipsey Hussle, Jay Rock, Freddie Gibbs.",
      "mediaKind": "person",
      "slotId": "comp:2124190032",
      "status": "proposed"
    },
    {
      "content": "Nicki Minaj",
      "contentRole": "Identify Nicki Minaj as one member of the narrated cohort",
      "evidence": "The rappers on that cover, and on the one the year before, came up on the same clock he did. 2009: Kid Cudi, B.o.B, Wale, Curren$y. 2010: J. Cole, Nicki Minaj, Wiz Khalifa, Big Sean, Nipsey Hussle, Jay Rock, Freddie Gibbs.",
      "mediaKind": "person",
      "slotId": "comp:2124190114",
      "status": "proposed"
    },
    {
      "content": "Nipsey Hussle",
      "contentRole": "Identify Nipsey Hussle as one member of the narrated cohort",
      "evidence": "The rappers on that cover, and on the one the year before, came up on the same clock he did. 2009: Kid Cudi, B.o.B, Wale, Curren$y. 2010: J. Cole, Nicki Minaj, Wiz Khalifa, Big Sean, Nipsey Hussle, Jay Rock, Freddie Gibbs.",
      "mediaKind": "person",
      "slotId": "comp:2124190143",
      "status": "proposed"
    },
    {
      "content": "Wale",
      "contentRole": "Identify Wale as one member of the narrated cohort",
      "evidence": "The rappers on that cover, and on the one the year before, came up on the same clock he did. 2009: Kid Cudi, B.o.B, Wale, Curren$y. 2010: J. Cole, Nicki Minaj, Wiz Khalifa, Big Sean, Nipsey Hussle, Jay Rock, Freddie Gibbs.",
      "mediaKind": "person",
      "slotId": "comp:2124190172",
      "status": "proposed"
    },
    {
      "content": "Wiz Khalifa",
      "contentRole": "Identify Wiz Khalifa as one member of the narrated cohort",
      "evidence": "The rappers on that cover, and on the one the year before, came up on the same clock he did. 2009: Kid Cudi, B.o.B, Wale, Curren$y. 2010: J. Cole, Nicki Minaj, Wiz Khalifa, Big Sean, Nipsey Hussle, Jay Rock, Freddie Gibbs.",
      "mediaKind": "person",
      "slotId": "comp:2124190228",
      "status": "proposed"
    }
  ],
  "renderingAuthorized": false,
  "requestSha256": "909c3f98856e699e02ac342235683256fb97afe5b57bd03c651aa6a0f3274106",
  "reviewState": "model_draft_unreviewed",
  "schemaVersion": 1,
  "selectionAuthorized": false,
  "taskId": "16-16.main",
  "textAssignments": [],
  "timingProposal": {
    "evidence": "duration observation only",
    "nativeDurationSeconds": 7.859999999999999,
    "proposedAdjustments": null,
    "status": "unresolved_user_policy",
    "taskDurationSeconds": 22.34
  },
  "treatmentSummary": "Propose only the source-supported assignments listed below; all unverified treatment demands and timing choices remain for editor review.",
  "unresolved": [
    {
      "field": "treatment required media slot count",
      "reason": "A semantic identity can be encoded by media, text, a mark, or a grouped asset; the current VisualTask does not assign identities to template media slots."
    },
    {
      "field": "treatment required text field count",
      "reason": "The narration and semantic constraints do not specify which content must appear as editable on-screen text for a particular treatment."
    },
    {
      "field": "text character, line, and wrapping fit",
      "reason": "The narration and semantic constraints do not specify which content must appear as editable on-screen text for a particular treatment."
    },
    {
      "field": "task required typed data fields",
      "reason": "Encoding categories are source-bound, but exact typed field names and values are not present in the current VisualTask contract."
    },
    {
      "field": "proposed media availability and visual suitability",
      "reason": "The request supplies native slot IDs and source identities/artifact references, but not an approved asset assignment or treatment-specific media-kind verification."
    },
    {
      "field": "timing adjustment policy",
      "reason": "The request requires a user decision before trim, loop, freeze, speed change, or extension can be proposed."
    }
  ],
  "verdict": null
}
