{
  "candidateId": "archive3-carousel-flow-loops-2026-09-15-08-02-14-utc--review-004",
  "dataAssignments": [],
  "evidence": [
    {
      "kind": "source_requirement",
      "quote": "Year seventeen of a rap career is anniversary-tour territory. Deluxe reissues with three unreleased demos on the back. A festival slot at seven-forty, before the headliner."
    }
  ],
  "mediaAssignments": [],
  "renderingAuthorized": false,
  "requestSha256": "276b8b1462a8e8b2c1e251618038abb95029aaeaf8a67e6bdbf109ecf3947372",
  "reviewState": "model_draft_unreviewed",
  "schemaVersion": 1,
  "selectionAuthorized": false,
  "taskId": "07-07.main",
  "textAssignments": [],
  "timingProposal": {
    "evidence": "duration observation only",
    "nativeDurationSeconds": 30.0,
    "proposedAdjustments": null,
    "status": "unresolved_user_policy",
    "taskDurationSeconds": 13.66
  },
  "treatmentSummary": "No native assignments are proposed because the request leaves treatment-specific media, text, data, semantic-fit, or timing decisions unresolved; the verified native controls remain available for editor review.",
  "unresolved": [
    {
      "field": "mediaAssignments",
      "reason": "The request does not provide a reviewed treatment-specific media-slot count and media-kind assignment, so no native media slot can be assigned without invention."
    },
    {
      "field": "textAssignments",
      "reason": "The request does not identify treatment-required exact on-screen strings or a reviewed mapping to native text fields."
    },
    {
      "field": "dataAssignments",
      "reason": "The request provides semantic constraints or encoding categories but no exact typed data fields and values for this treatment."
    },
    {
      "field": "semanticTreatmentMapping",
      "reason": "No reviewed assignment proves that this candidate treatment makes every truth and perceptibility constraint legible while avoiding every prohibited implication."
    },
    {
      "field": "timingProposal.proposedAdjustments",
      "reason": "The request requires a user decision before trim, loop, freeze, speed change, or extension can be proposed."
    },
    {
      "field": "editorReview",
      "reason": "This is an unreviewed model draft and cannot approve, select, or authorize the candidate."
    }
  ],
  "verdict": null
}
