{
  "candidateId": "counters-envato--scene-003",
  "dataAssignments": [],
  "evidence": [
    {
      "kind": "source_requirement",
      "quote": "Lil Baby is certifying his own records at a faster yearly clip than Drake has averaged across the whole run — about twenty-two million units a year against twenty and a half."
    }
  ],
  "mediaAssignments": [],
  "renderingAuthorized": false,
  "requestSha256": "562329bb47d364328591050732078905615e57433831de183b1b6753a6d25bd6",
  "reviewState": "model_draft_unreviewed",
  "schemaVersion": 1,
  "selectionAuthorized": false,
  "taskId": "29-29a.main",
  "textAssignments": [],
  "timingProposal": {
    "evidence": "duration observation only",
    "nativeDurationSeconds": 60.0,
    "proposedAdjustments": null,
    "status": "unresolved_user_policy",
    "taskDurationSeconds": 10.6
  },
  "treatmentSummary": "No native assignments are proposed because the request leaves treatment-specific media, text, data, semantic-fit, or timing decisions unresolved; the verified native controls remain available for editor review.",
  "unresolved": [
    {
      "field": "mediaAssignments",
      "reason": "The request does not provide a reviewed treatment-specific media-slot count and media-kind assignment, so no native media slot can be assigned without invention."
    },
    {
      "field": "textAssignments",
      "reason": "The request does not identify treatment-required exact on-screen strings or a reviewed mapping to native text fields."
    },
    {
      "field": "dataAssignments",
      "reason": "The request provides semantic constraints or encoding categories but no exact typed data fields and values for this treatment."
    },
    {
      "field": "semanticTreatmentMapping",
      "reason": "No reviewed assignment proves that this candidate treatment makes every truth and perceptibility constraint legible while avoiding every prohibited implication."
    },
    {
      "field": "timingProposal.proposedAdjustments",
      "reason": "The request requires a user decision before trim, loop, freeze, speed change, or extension can be proposed."
    },
    {
      "field": "editorReview",
      "reason": "This is an unreviewed model draft and cannot approve, select, or authorize the candidate."
    }
  ],
  "verdict": null
}
