{
  "candidateId": "photo-slideshow-memories-envato--scene-008",
  "dataAssignments": [],
  "evidence": [
    {
      "kind": "source_requirement",
      "quote": "Ab-Soul falls twenty-eight places. Latto falls thirteen. Jay Rock, twelve."
    },
    {
      "kind": "verified_native_fact",
      "quote": "The reviewed 40.30–48.70 second boundary is bound to one exact native master-window anchor plus verified child layers spanning this master timeline; exact window capacity and receipts are frozen in reports/clip-mapping-batch-010.json."
    }
  ],
  "mediaAssignments": [],
  "renderingAuthorized": false,
  "requestSha256": "ad7d82fc9c8950f6445cd5e84c10058bc53004792bc43e4125796862eca61672",
  "reviewState": "model_draft_unreviewed",
  "schemaVersion": 1,
  "selectionAuthorized": false,
  "taskId": "12-12a.main",
  "textAssignments": [],
  "timingProposal": {
    "evidence": "duration observation only",
    "nativeDurationSeconds": 8.400000000000006,
    "proposedAdjustments": null,
    "status": "unresolved_user_policy",
    "taskDurationSeconds": 5.26
  },
  "treatmentSummary": "Propose only the source-supported assignments listed below; all unverified treatment demands and timing choices remain for editor review.",
  "unresolved": [
    {
      "field": "candidate treatment relationship",
      "reason": "The reviewed condition requires three time points of one subject, while the task names three independent people."
    },
    {
      "field": "treatment required media slot count",
      "reason": "A semantic identity can be encoded by media, text, a mark, or a grouped asset; the current VisualTask does not assign identities to template media slots."
    },
    {
      "field": "treatment required text field count",
      "reason": "The narration and semantic constraints do not specify which content must appear as editable on-screen text for a particular treatment."
    },
    {
      "field": "text character, line, and wrapping fit",
      "reason": "The narration and semantic constraints do not specify which content must appear as editable on-screen text for a particular treatment."
    },
    {
      "field": "task required typed data fields",
      "reason": "Encoding categories are source-bound, but exact typed field names and values are not present in the current VisualTask contract."
    },
    {
      "field": "native quantitative or relational encoding",
      "reason": "The narration contains values or relationships, but native media/text controls alone do not prove the template can encode that relationship."
    },
    {
      "field": "timing adjustment policy",
      "reason": "The request requires a user decision before trim, loop, freeze, speed change, or extension can be proposed."
    }
  ],
  "verdict": null
}
