{
  "candidateId": "scrolling-screen--review-005",
  "dataAssignments": [],
  "evidence": [
    {
      "kind": "source_requirement",
      "quote": "In 2010, XXL offered him a spot on the Freshman cover. He turned it down."
    },
    {
      "kind": "verified_native_fact",
      "quote": "The reviewed 40.06–50.03 second boundary is bound by a constant preview offset to verified native child layers spanning this master composition; exact window capacity and receipts are frozen in reports/clip-mapping-batch-009.json."
    }
  ],
  "mediaAssignments": [
    {
      "content": "Drake",
      "contentRole": "Present Drake as a named subject in the comparison",
      "evidence": "In 2010, XXL offered him a spot on the Freshman cover. He turned it down.",
      "mediaKind": "person",
      "slotId": "comp:2128067774",
      "status": "proposed"
    }
  ],
  "renderingAuthorized": false,
  "requestSha256": "fb6bba15233a8f9b9f4cecd44377286f8ab90bd151d5b38134fe815c5a764eb6",
  "reviewState": "model_draft_unreviewed",
  "schemaVersion": 1,
  "selectionAuthorized": false,
  "taskId": "15-15.main",
  "textAssignments": [
    {
      "contentRole": "Carry one source-stated label or value",
      "evidence": "In 2010, XXL offered him a spot on the Freshman cover. He turned it down.",
      "fieldId": "text:2128067164:4",
      "fitStatus": "unverified",
      "text": "2010"
    },
    {
      "contentRole": "Carry one source-stated label or value",
      "evidence": "In 2010, XXL offered him a spot on the Freshman cover. He turned it down.",
      "fieldId": "text:2128067164:5",
      "fitStatus": "unverified",
      "text": "XXL Freshman cover"
    },
    {
      "contentRole": "Carry one source-stated label or value",
      "evidence": "In 2010, XXL offered him a spot on the Freshman cover. He turned it down.",
      "fieldId": "text:2128067337:4",
      "fitStatus": "unverified",
      "text": "Drake turned it down"
    }
  ],
  "timingProposal": {
    "evidence": "duration observation only",
    "nativeDurationSeconds": 9.969999999999999,
    "proposedAdjustments": null,
    "status": "unresolved_user_policy",
    "taskDurationSeconds": 5.86
  },
  "treatmentSummary": "Propose only the source-supported assignments listed below; all unverified treatment demands and timing choices remain for editor review.",
  "unresolved": [
    {
      "field": "treatment required media slot count",
      "reason": "A typed editor/treatment media requirement is bound to this exact VisualTask."
    },
    {
      "field": "treatment required text field count",
      "reason": "The narration and semantic constraints do not specify which content must appear as editable on-screen text for a particular treatment."
    },
    {
      "field": "text character, line, and wrapping fit",
      "reason": "The narration and semantic constraints do not specify which content must appear as editable on-screen text for a particular treatment."
    },
    {
      "field": "task required typed data fields",
      "reason": "Encoding categories are source-bound, but exact typed field names and values are not present in the current VisualTask contract."
    },
    {
      "field": "proposed media availability and visual suitability",
      "reason": "The request supplies native slot IDs and source identities/artifact references, but not an approved asset assignment or treatment-specific media-kind verification."
    },
    {
      "field": "proposed text fit",
      "reason": "The exact strings are source-supported proposals only; character, line, and wrapping fit has not been verified."
    },
    {
      "field": "timing adjustment policy",
      "reason": "The request requires a user decision before trim, loop, freeze, speed change, or extension can be proposed."
    }
  ],
  "verdict": null
}
