{
  "candidateId": "scrolling-screen--review-001",
  "dataAssignments": [],
  "evidence": [
    {
      "kind": "source_requirement",
      "quote": "The rappers on that cover, and on the one the year before, came up on the same clock he did. 2009: Kid Cudi, B.o.B, Wale, Curren$y. 2010: J. Cole, Nicki Minaj, Wiz Khalifa, Big Sean, Nipsey Hussle, Jay Rock, Freddie Gibbs."
    },
    {
      "kind": "verified_native_fact",
      "quote": "The reviewed 0.93–10.00 second boundary is bound by a constant preview offset to verified native child layers spanning this master composition; exact window capacity and receipts are frozen in reports/clip-mapping-batch-009.json."
    }
  ],
  "mediaAssignments": [],
  "renderingAuthorized": false,
  "requestSha256": "2a687d650a6da5bd178571a7cedae268b71410e6ac7296cd925019b095f20de3",
  "reviewState": "model_draft_unreviewed",
  "schemaVersion": 1,
  "selectionAuthorized": false,
  "taskId": "16-16.main",
  "textAssignments": [
    {
      "contentRole": "Carry one source-stated label or value",
      "evidence": "The rappers on that cover, and on the one the year before, came up on the same clock he did. 2009: Kid Cudi, B.o.B, Wale, Curren$y. 2010: J. Cole, Nicki Minaj, Wiz Khalifa, Big Sean, Nipsey Hussle, Jay Rock, Freddie Gibbs.",
      "fieldId": "text:410:4",
      "fitStatus": "unverified",
      "text": "2009"
    },
    {
      "contentRole": "Carry one source-stated label or value",
      "evidence": "The rappers on that cover, and on the one the year before, came up on the same clock he did. 2009: Kid Cudi, B.o.B, Wale, Curren$y. 2010: J. Cole, Nicki Minaj, Wiz Khalifa, Big Sean, Nipsey Hussle, Jay Rock, Freddie Gibbs.",
      "fieldId": "text:410:5",
      "fitStatus": "unverified",
      "text": "Kid Cudi"
    },
    {
      "contentRole": "Carry one source-stated label or value",
      "evidence": "The rappers on that cover, and on the one the year before, came up on the same clock he did. 2009: Kid Cudi, B.o.B, Wale, Curren$y. 2010: J. Cole, Nicki Minaj, Wiz Khalifa, Big Sean, Nipsey Hussle, Jay Rock, Freddie Gibbs.",
      "fieldId": "text:410:6",
      "fitStatus": "unverified",
      "text": "B.o.B"
    }
  ],
  "timingProposal": {
    "evidence": "duration observation only",
    "nativeDurationSeconds": 9.07,
    "proposedAdjustments": null,
    "status": "unresolved_user_policy",
    "taskDurationSeconds": 22.34
  },
  "treatmentSummary": "Propose only the source-supported assignments listed below; all unverified treatment demands and timing choices remain for editor review.",
  "unresolved": [
    {
      "field": "complete independent identity presentation",
      "reason": "The supplied request does not provide enough verified native media slots and/or display-eligible identities to assign the complete narrated set without inventing controls or identities."
    },
    {
      "field": "treatment required media slot count",
      "reason": "A semantic identity can be encoded by media, text, a mark, or a grouped asset; the current VisualTask does not assign identities to template media slots."
    },
    {
      "field": "treatment required text field count",
      "reason": "The narration and semantic constraints do not specify which content must appear as editable on-screen text for a particular treatment."
    },
    {
      "field": "text character, line, and wrapping fit",
      "reason": "The narration and semantic constraints do not specify which content must appear as editable on-screen text for a particular treatment."
    },
    {
      "field": "task required typed data fields",
      "reason": "Encoding categories are source-bound, but exact typed field names and values are not present in the current VisualTask contract."
    },
    {
      "field": "proposed text fit",
      "reason": "The exact strings are source-supported proposals only; character, line, and wrapping fit has not been verified."
    },
    {
      "field": "timing adjustment policy",
      "reason": "The request requires a user decision before trim, loop, freeze, speed change, or extension can be proposed."
    }
  ],
  "verdict": null
}
