{
  "candidateId": "intro-slideshow-full-720p--scene-020",
  "dataAssignments": [],
  "evidence": [
    {
      "kind": "source_requirement",
      "quote": "A song from 2015 streams in 2026 without the artist lifting a finger. Music has no body that gives out. So the top of the daily chart in year seventeen could be a very large archive on autoplay while the man himself stopped mattering somewhere around Views."
    },
    {
      "kind": "verified_native_fact",
      "quote": "The saved scene cut and the source-bound 154.48-second native 02:34 composition share the same 25 fps timeline; exact interval propagation measures 63.68-68.08 seconds, including the native Scene 17-to-18 boundary."
    }
  ],
  "mediaAssignments": [],
  "renderingAuthorized": false,
  "requestSha256": "863a7084b992e4af4700815dd27a3cfacc2c2a6d8fedd5c1171efbe47d343060",
  "reviewState": "model_draft_unreviewed",
  "schemaVersion": 1,
  "selectionAuthorized": false,
  "taskId": "23-23.main",
  "textAssignments": [],
  "timingProposal": {
    "evidence": "duration observation only",
    "nativeDurationSeconds": 4.399999999999999,
    "proposedAdjustments": null,
    "status": "unresolved_user_policy",
    "taskDurationSeconds": 20.02
  },
  "treatmentSummary": "Propose only the source-supported assignments listed below; all unverified treatment demands and timing choices remain for editor review.",
  "unresolved": [
    {
      "field": "treatment required media slot count",
      "reason": "A semantic identity can be encoded by media, text, a mark, or a grouped asset; the current VisualTask does not assign identities to template media slots."
    },
    {
      "field": "treatment required text field count",
      "reason": "The narration and semantic constraints do not specify which content must appear as editable on-screen text for a particular treatment."
    },
    {
      "field": "text character, line, and wrapping fit",
      "reason": "The narration and semantic constraints do not specify which content must appear as editable on-screen text for a particular treatment."
    },
    {
      "field": "task required typed data fields",
      "reason": "Encoding categories are source-bound, but exact typed field names and values are not present in the current VisualTask contract."
    },
    {
      "field": "timing adjustment policy",
      "reason": "The request requires a user decision before trim, loop, freeze, speed change, or extension can be proposed."
    }
  ],
  "verdict": null
}
