{
  "candidateId": "screen-mockup-rfx--review-002",
  "dataAssignments": [],
  "evidence": [
    {
      "kind": "source_requirement",
      "quote": "Curren$y was on the 2009 XXL Freshman cover"
    },
    {
      "kind": "reviewed_media_requirement",
      "quote": "The right asset is the COVER, not a portrait."
    }
  ],
  "mediaAssignments": [
    {
      "content": "2009 XXL Freshman cover",
      "contentRole": "Show the referenced cover containing Curren$y rather than a generic portrait",
      "evidence": "Editor direction bound in the typed VisualTask media requirement: the right asset is the COVER, not a portrait.",
      "mediaKind": "artwork",
      "slotId": "footage:1126",
      "status": "proposed"
    }
  ],
  "renderingAuthorized": false,
  "requestSha256": "b0719639e6c2940bcbfbc89abc9a1c4484ad7f7b34c012069189f686691bc80c",
  "reviewState": "model_draft_unreviewed",
  "schemaVersion": 1,
  "selectionAuthorized": false,
  "taskId": "02-02a.main",
  "textAssignments": [],
  "timingProposal": {
    "evidence": "duration observation only",
    "nativeDurationSeconds": 8.008008008008009,
    "proposedAdjustments": null,
    "status": "unresolved_user_policy",
    "taskDurationSeconds": 3.1
  },
  "treatmentSummary": "No native assignments are proposed because the request leaves treatment-specific media, text, data, semantic-fit, or timing decisions unresolved; the verified native controls remain available for editor review.",
  "unresolved": [
    {
      "field": "textAssignments",
      "reason": "The request does not identify treatment-required exact on-screen strings or a reviewed mapping to native text fields."
    },
    {
      "field": "dataAssignments",
      "reason": "The request provides semantic constraints or encoding categories but no exact typed data fields and values for this treatment."
    },
    {
      "field": "semanticTreatmentMapping",
      "reason": "No reviewed assignment proves that this candidate treatment makes every truth and perceptibility constraint legible while avoiding every prohibited implication."
    },
    {
      "field": "timingProposal.proposedAdjustments",
      "reason": "The request requires a user decision before trim, loop, freeze, speed change, or extension can be proposed."
    },
    {
      "field": "editorReview",
      "reason": "This is an unreviewed model draft and cannot approve, select, or authorize the candidate."
    }
  ],
  "verdict": null
}
