{
  "candidateId": "memories-photo-slideshow-creative-slides-envato--scene-006",
  "dataAssignments": [],
  "evidence": [
    {
      "kind": "source_requirement",
      "quote": "He gets accused of living on features. He's done a hundred and eighty-one of them. Future has done two hundred thirty-two. Young Thug, three hundred and two."
    },
    {
      "kind": "verified_native_fact",
      "quote": "The reviewed 27.56–34.44 second boundary is bound to one exact native master-window anchor plus verified child layers spanning this master timeline; exact window capacity and receipts are frozen in reports/clip-mapping-batch-012.json."
    }
  ],
  "mediaAssignments": [
    {
      "content": "Future",
      "contentRole": "Present Future as a named subject in the comparison",
      "evidence": "He gets accused of living on features. He's done a hundred and eighty-one of them. Future has done two hundred thirty-two. Young Thug, three hundred and two.",
      "mediaKind": "person",
      "slotId": "comp:3278",
      "status": "proposed"
    },
    {
      "content": "Young Thug",
      "contentRole": "Present Young Thug as a named subject in the comparison",
      "evidence": "He gets accused of living on features. He's done a hundred and eighty-one of them. Future has done two hundred thirty-two. Young Thug, three hundred and two.",
      "mediaKind": "person",
      "slotId": "comp:3312",
      "status": "proposed"
    }
  ],
  "renderingAuthorized": false,
  "requestSha256": "04b10de496abc25025d812517970c4e9cfefe95770645fd5cc5738d1c8624c8c",
  "reviewState": "model_draft_unreviewed",
  "schemaVersion": 1,
  "selectionAuthorized": false,
  "taskId": "21-21a.main",
  "textAssignments": [],
  "timingProposal": {
    "evidence": "duration observation only",
    "nativeDurationSeconds": 6.879999999999999,
    "proposedAdjustments": null,
    "status": "unresolved_user_policy",
    "taskDurationSeconds": 8.48
  },
  "treatmentSummary": "Propose only the source-supported assignments listed below; all unverified treatment demands and timing choices remain for editor review.",
  "unresolved": [
    {
      "field": "treatment required media slot count",
      "reason": "A semantic identity can be encoded by media, text, a mark, or a grouped asset; the current VisualTask does not assign identities to template media slots."
    },
    {
      "field": "treatment required text field count",
      "reason": "The narration and semantic constraints do not specify which content must appear as editable on-screen text for a particular treatment."
    },
    {
      "field": "text character, line, and wrapping fit",
      "reason": "The narration and semantic constraints do not specify which content must appear as editable on-screen text for a particular treatment."
    },
    {
      "field": "task required typed data fields",
      "reason": "Encoding categories are source-bound, but exact typed field names and values are not present in the current VisualTask contract."
    },
    {
      "field": "native quantitative or relational encoding",
      "reason": "The narration contains values or relationships, but native media/text controls alone do not prove the template can encode that relationship."
    },
    {
      "field": "proposed media availability and visual suitability",
      "reason": "The request supplies native slot IDs and source identities/artifact references, but not an approved asset assignment or treatment-specific media-kind verification."
    },
    {
      "field": "timing adjustment policy",
      "reason": "The request requires a user decision before trim, loop, freeze, speed change, or extension can be proposed."
    }
  ],
  "verdict": null
}
