{
  "candidateId": "memories-photo-slideshow-creative-slides-envato--scene-007",
  "dataAssignments": [],
  "evidence": [
    {
      "kind": "source_requirement",
      "quote": "A song from 2015 streams in 2026 without the artist lifting a finger. Music has no body that gives out. So the top of the daily chart in year seventeen could be a very large archive on autoplay while the man himself stopped mattering somewhere around Views."
    },
    {
      "kind": "verified_native_fact",
      "quote": "The reviewed 32.56–40.20 second boundary is bound to one exact native master-window anchor plus verified child layers spanning this master timeline; exact window capacity and receipts are frozen in reports/clip-mapping-batch-012.json."
    }
  ],
  "mediaAssignments": [],
  "renderingAuthorized": false,
  "requestSha256": "05711b85354e8ac6047563d4b759f14d56d7a390231316ba0f76024566793454",
  "reviewState": "model_draft_unreviewed",
  "schemaVersion": 1,
  "selectionAuthorized": false,
  "taskId": "23-23.main",
  "textAssignments": [],
  "timingProposal": {
    "evidence": "duration observation only",
    "nativeDurationSeconds": 7.640000000000001,
    "proposedAdjustments": null,
    "status": "unresolved_user_policy",
    "taskDurationSeconds": 20.02
  },
  "treatmentSummary": "Propose only the source-supported assignments listed below; all unverified treatment demands and timing choices remain for editor review.",
  "unresolved": [
    {
      "field": "treatment required media slot count",
      "reason": "A semantic identity can be encoded by media, text, a mark, or a grouped asset; the current VisualTask does not assign identities to template media slots."
    },
    {
      "field": "treatment required text field count",
      "reason": "The narration and semantic constraints do not specify which content must appear as editable on-screen text for a particular treatment."
    },
    {
      "field": "text character, line, and wrapping fit",
      "reason": "The narration and semantic constraints do not specify which content must appear as editable on-screen text for a particular treatment."
    },
    {
      "field": "task required typed data fields",
      "reason": "Encoding categories are source-bound, but exact typed field names and values are not present in the current VisualTask contract."
    },
    {
      "field": "timing adjustment policy",
      "reason": "The request requires a user decision before trim, loop, freeze, speed change, or extension can be proposed."
    }
  ],
  "verdict": null
}
