{
  "candidateId": "06-the-history--scene-004",
  "dataAssignments": [],
  "evidence": [
    {
      "kind": "source_requirement",
      "quote": "One rule, applied to everybody. A record you lead, or share the lead on equally, counts in full. A feature or a remix verse counts at half."
    },
    {
      "kind": "verified_native_fact",
      "quote": "The approved clip is SEQ_4, and the native | SEQ_ALL timeline places the SEQ_4 composition in the fourth sequence interval."
    }
  ],
  "mediaAssignments": [],
  "renderingAuthorized": false,
  "requestSha256": "9bec59550f743c3db87ef1c91baa3c70e60c542e5268e1a956af23ef1d76a763",
  "reviewState": "model_draft_unreviewed",
  "schemaVersion": 1,
  "selectionAuthorized": false,
  "taskId": "17-17.main",
  "textAssignments": [
    {
      "contentRole": "Carry one source-stated label or value",
      "evidence": "One rule, applied to everybody. A record you lead, or share the lead on equally, counts in full. A feature or a remix verse counts at half.",
      "fieldId": "text:2124209932:1",
      "fitStatus": "unverified",
      "text": "ONE RULE"
    },
    {
      "contentRole": "Carry one source-stated label or value",
      "evidence": "One rule, applied to everybody. A record you lead, or share the lead on equally, counts in full. A feature or a remix verse counts at half.",
      "fieldId": "text:2124209992:1",
      "fitStatus": "unverified",
      "text": "Lead or equal co-lead: full credit"
    }
  ],
  "timingProposal": {
    "evidence": "duration observation only",
    "nativeDurationSeconds": 10.0,
    "proposedAdjustments": null,
    "status": "unresolved_user_policy",
    "taskDurationSeconds": 10.76
  },
  "treatmentSummary": "Propose only the source-supported assignments listed below; all unverified treatment demands and timing choices remain for editor review.",
  "unresolved": [
    {
      "field": "treatment required media slot count",
      "reason": "A semantic identity can be encoded by media, text, a mark, or a grouped asset; the current VisualTask does not assign identities to template media slots."
    },
    {
      "field": "treatment required text field count",
      "reason": "The narration and semantic constraints do not specify which content must appear as editable on-screen text for a particular treatment."
    },
    {
      "field": "text character, line, and wrapping fit",
      "reason": "The narration and semantic constraints do not specify which content must appear as editable on-screen text for a particular treatment."
    },
    {
      "field": "task required typed data fields",
      "reason": "Encoding categories are source-bound, but exact typed field names and values are not present in the current VisualTask contract."
    },
    {
      "field": "proposed text fit",
      "reason": "The exact strings are source-supported proposals only; character, line, and wrapping fit has not been verified."
    },
    {
      "field": "timing adjustment policy",
      "reason": "The request requires a user decision before trim, loop, freeze, speed change, or extension can be proposed."
    }
  ],
  "verdict": null
}
