{
  "candidateId": "counters-envato--scene-002",
  "dataAssignments": [],
  "evidence": [
    {
      "kind": "source_requirement",
      "quote": "Fewer verses than either, more streams than anyone: forty-three billion, roughly two hundred forty million a verse."
    },
    {
      "kind": "verified_native_fact",
      "quote": "The approved Counter 02 clip matches the identically numbered native counter composition and its value-plus-caption field structure."
    }
  ],
  "mediaAssignments": [],
  "renderingAuthorized": false,
  "requestSha256": "e292e99bf75c9c7b67af661d294c405713f7b75f97d0e0043a3581e23e7de1c3",
  "reviewState": "model_draft_unreviewed",
  "schemaVersion": 1,
  "selectionAuthorized": false,
  "taskId": "21-21b.main",
  "textAssignments": [
    {
      "contentRole": "Carry one source-stated label or value",
      "evidence": "Fewer verses than either, more streams than anyone: forty-three billion, roughly two hundred forty million a verse.",
      "fieldId": "text:31453:1",
      "fitStatus": "unverified",
      "text": "43 billion"
    },
    {
      "contentRole": "Carry one source-stated label or value",
      "evidence": "Fewer verses than either, more streams than anyone: forty-three billion, roughly two hundred forty million a verse.",
      "fieldId": "text:31472:1",
      "fitStatus": "unverified",
      "text": "≈240 million per verse"
    }
  ],
  "timingProposal": {
    "evidence": "duration observation only",
    "nativeDurationSeconds": 60.0,
    "proposedAdjustments": null,
    "status": "unresolved_user_policy",
    "taskDurationSeconds": 9.64
  },
  "treatmentSummary": "Propose only the source-supported assignments listed below; all unverified treatment demands and timing choices remain for editor review.",
  "unresolved": [
    {
      "field": "treatment required media slot count",
      "reason": "A semantic identity can be encoded by media, text, a mark, or a grouped asset; the current VisualTask does not assign identities to template media slots."
    },
    {
      "field": "treatment required text field count",
      "reason": "The narration and semantic constraints do not specify which content must appear as editable on-screen text for a particular treatment."
    },
    {
      "field": "text character, line, and wrapping fit",
      "reason": "The narration and semantic constraints do not specify which content must appear as editable on-screen text for a particular treatment."
    },
    {
      "field": "task required typed data fields",
      "reason": "Encoding categories are source-bound, but exact typed field names and values are not present in the current VisualTask contract."
    },
    {
      "field": "native quantitative or relational encoding",
      "reason": "The narration contains values or relationships, but native media/text controls alone do not prove the template can encode that relationship."
    },
    {
      "field": "proposed text fit",
      "reason": "The exact strings are source-supported proposals only; character, line, and wrapping fit has not been verified."
    },
    {
      "field": "timing adjustment policy",
      "reason": "The request requires a user decision before trim, loop, freeze, speed change, or extension can be proposed."
    }
  ],
  "verdict": null
}
