{
  "candidateId": "intro-slideshow-full-720p--scene-031",
  "dataAssignments": [],
  "evidence": [
    {
      "kind": "source_requirement",
      "quote": "That's the class. Now put the same slice against the names near the top of the opening chart, full catalogs, everything at full credit. Travis Scott, sixty-seven billion. Kendrick, fifty-seven. Post Malone, fifty-six. Future, fifty-four. The slice clears every one of them."
    },
    {
      "kind": "verified_native_fact",
      "quote": "The saved scene cut and native 02:34 composition share the same 25 fps timeline; exact interval propagation measures 96.36-101.16 seconds."
    }
  ],
  "mediaAssignments": [
    {
      "content": "Future",
      "contentRole": "Present Future as a named subject in the comparison",
      "evidence": "That's the class. Now put the same slice against the names near the top of the opening chart, full catalogs, everything at full credit. Travis Scott, sixty-seven billion. Kendrick, fifty-seven. Post Malone, fifty-six. Future, fifty-four. The slice clears every one of them.",
      "mediaKind": "person",
      "slotId": "comp:96765",
      "status": "proposed"
    },
    {
      "content": "Kendrick Lamar",
      "contentRole": "Present Kendrick Lamar as a named subject in the comparison",
      "evidence": "That's the class. Now put the same slice against the names near the top of the opening chart, full catalogs, everything at full credit. Travis Scott, sixty-seven billion. Kendrick, fifty-seven. Post Malone, fifty-six. Future, fifty-four. The slice clears every one of them.",
      "mediaKind": "person",
      "slotId": "comp:96777",
      "status": "proposed"
    },
    {
      "content": "Post Malone",
      "contentRole": "Present Post Malone as a named subject in the comparison",
      "evidence": "That's the class. Now put the same slice against the names near the top of the opening chart, full catalogs, everything at full credit. Travis Scott, sixty-seven billion. Kendrick, fifty-seven. Post Malone, fifty-six. Future, fifty-four. The slice clears every one of them.",
      "mediaKind": "person",
      "slotId": "comp:96789",
      "status": "proposed"
    },
    {
      "content": "Travis Scott",
      "contentRole": "Present Travis Scott as a named subject in the comparison",
      "evidence": "That's the class. Now put the same slice against the names near the top of the opening chart, full catalogs, everything at full credit. Travis Scott, sixty-seven billion. Kendrick, fifty-seven. Post Malone, fifty-six. Future, fifty-four. The slice clears every one of them.",
      "mediaKind": "person",
      "slotId": "comp:96801",
      "status": "proposed"
    }
  ],
  "renderingAuthorized": false,
  "requestSha256": "9f677b309bc4d44c86aa40a1012e2ed3bc42327ca9e3e679f8416cd0b87b1909",
  "reviewState": "model_draft_unreviewed",
  "schemaVersion": 1,
  "selectionAuthorized": false,
  "taskId": "20-20.main",
  "textAssignments": [],
  "timingProposal": {
    "evidence": "duration observation only",
    "nativeDurationSeconds": 4.799999999999997,
    "proposedAdjustments": null,
    "status": "unresolved_user_policy",
    "taskDurationSeconds": 23.14
  },
  "treatmentSummary": "Propose only the source-supported assignments listed below; all unverified treatment demands and timing choices remain for editor review.",
  "unresolved": [
    {
      "field": "treatment required media slot count",
      "reason": "A semantic identity can be encoded by media, text, a mark, or a grouped asset; the current VisualTask does not assign identities to template media slots."
    },
    {
      "field": "treatment required text field count",
      "reason": "The narration and semantic constraints do not specify which content must appear as editable on-screen text for a particular treatment."
    },
    {
      "field": "text character, line, and wrapping fit",
      "reason": "The narration and semantic constraints do not specify which content must appear as editable on-screen text for a particular treatment."
    },
    {
      "field": "task required typed data fields",
      "reason": "Encoding categories are source-bound, but exact typed field names and values are not present in the current VisualTask contract."
    },
    {
      "field": "native quantitative or relational encoding",
      "reason": "The narration contains values or relationships, but native media/text controls alone do not prove the template can encode that relationship."
    },
    {
      "field": "proposed media availability and visual suitability",
      "reason": "The request supplies native slot IDs and source identities/artifact references, but not an approved asset assignment or treatment-specific media-kind verification."
    },
    {
      "field": "timing adjustment policy",
      "reason": "The request requires a user decision before trim, loop, freeze, speed change, or extension can be proposed."
    }
  ],
  "verdict": null
}
